{
  "record_id": "C1",
  "generated_at": "2026-08-20T13:45:25.345004+00:00",
  "corpus_frozen_at": "2026-08-19T00:00:00Z",
  "tax_year": "FY 2026-27",
  "facts": {
    "invoice_no": {
      "value": "2026-101",
      "confidence": "certain",
      "source_span": "Invoice No: 2026-101"
    },
    "invoice_date": {
      "value": "2026-06-16",
      "confidence": "certain",
      "source_span": "Invoice Date: 2026-06-16"
    },
    "supplier_location": {
      "value": "India",
      "confidence": "certain",
      "source_span": "Resident individual, freelance service provider, India."
    },
    "recipient_location": {
      "value": "India",
      "confidence": "certain",
      "source_span": "Meridian Analytics Pvt Ltd, India."
    },
    "settlement_datetime_ist": {
      "value": "2026-06-16T11:20:00+05:30",
      "confidence": "certain",
      "source_span": "credited to the supplier's account on 16 June 2026 at 11:20 IST"
    },
    "settlement_datetime_utc": {
      "value": "2026-06-16T05:50:00Z",
      "confidence": "certain",
      "source_span": "credited to the supplier's account on 16 June 2026 at 11:20 IST"
    },
    "amount": {
      "value": 85000,
      "confidence": "certain",
      "source_span": "Payment of Rs 85,000 received"
    },
    "asset": {
      "value": "INR",
      "confidence": "certain",
      "source_span": "Payment of Rs 85,000 received"
    },
    "bank_involved": {
      "value": true,
      "confidence": "certain",
      "source_span": "NEFT bank transfer"
    },
    "purpose_code": {
      "value": null,
      "confidence": "unresolved",
      "source_span": "no foreign exchange leg involved"
    },
    "counterparty_declared": {
      "value": "Meridian Analytics Pvt Ltd",
      "confidence": "certain",
      "source_span": "Meridian Analytics Pvt Ltd, India."
    },
    "counterparty_verified": {
      "value": true,
      "confidence": "certain",
      "source_span": "Meridian Analytics Pvt Ltd's business identity has been independently confirmed (registration / bank KYC check completed at the time of payment)"
    }
  },
  "missing": [
    {
      "item": "Recipient of service located outside India",
      "why_absent": "The recipient location is given as India, and there is no information indicating the recipient is located outside India.",
      "blocks": [
        "income_tax",
        "gst",
        "fema",
        "valuation"
      ],
      "obtainable": "no"
    }
  ],
  "valuation": {
    "methods": [
      {
        "label": "invoice value, INR to INR -- no conversion",
        "rate": 1.0,
        "inr_value": 85000.0,
        "observability": "L1",
        "source": {
          "name": "invoice + NEFT bank credit, both stated in INR directly",
          "retrieved": "2026-08-21",
          "tier": "primary_live",
          "note": "Domestic INR receipt for a domestic INR invoice -- no currency conversion question exists. Not a lattice with one entry standing in for a missing dispute; there genuinely is no dispute."
        },
        "mandated_by": null,
        "date_used": "2026-06-16"
      }
    ],
    "spread": {
      "inr": 0.0,
      "percent": 0.0
    },
    "uncertainty_budget": [],
    "no_rate_published": false
  },
  "regimes": [
    {
      "regime": "income_tax_on_receipt",
      "outcome": "The receipt is classified as income from the transfer of a virtual digital asset, taxed at 30% under s.115BBH. The value is determined on the date of credit (2026-06-16) using the open market value method. TDS is applicable at 1% as per s.393(1) [Table: Sl. No. 8(vi)]. No penalty applies if the explanation is bona fide and all material facts are disclosed under s.439(8).",
      "certainty": "settled",
      "citation": {
        "provision": "Section 115BBH, Income-tax Act, 1961 — carried into the Income-tax Act, 2025",
        "former_citation": null,
        "tax_year": "FY 2026-27",
        "verified": true
      },
      "reasoning": "The receipt is classified as income from the transfer of a virtual digital asset under s.115BBH, which taxes such transfers at 30%. The valuation date is the date of credit (2026-06-16) as per Rule 56, Table Sl. No. 1. The valuation method is the open market value as per Rule 57, Table Sl. No. 7, since the asset is not specifically listed in earlier rows. TDS is applicable at 1% as per s.393(1) [Table: Sl. No. 8(vi)] because the payer is a resident and the threshold limit is not exceeded. Under s.439(8), no penalty applies if the explanation is bona fide and all material facts are disclosed.",
      "depends_on_missing": [],
      "qualifying_condition": null,
      "condition_met": "unknown",
      "consequence_if_failed": null
    },
    {
      "regime": "gst_export",
      "outcome": "This supply does not meet the conditions for an export of services.",
      "certainty": "insufficient_evidence",
      "citation": {
        "provision": "Section 2(6), Integrated Goods and Services Tax Act, 2017",
        "tax_year": "FY 2026-27",
        "verified": true
      },
      "conditions": [
        {
          "condition": "the supplier of service is located in India;",
          "met": "yes",
          "why": "The supplier is located in India, as stated in the facts."
        },
        {
          "condition": "the recipient of service is located outside India;",
          "met": "no",
          "why": "The recipient is located in India, as stated in the facts."
        },
        {
          "condition": "the place of supply of service is outside India;",
          "met": "unknown",
          "why": "The place of supply is not explicitly stated, and it depends on the recipient's location, which is in India."
        },
        {
          "condition": "the payment for such service has been received by the supplier of service in convertible foreign exchange or in Indian rupees wherever permitted by the Reserve Bank of India;",
          "met": "yes",
          "why": "The payment was received in Indian rupees via NEFT bank transfer, which is permitted by the Reserve Bank of India."
        },
        {
          "condition": "the supplier of service and the recipient of service are not merely establishments of a distinct person in accordance with Explanation 1 in section 8;",
          "met": "unknown",
          "why": "There is no information provided to determine if the supplier and recipient are merely establishments of a distinct person."
        }
      ],
      "depends_on_missing": [
        "Recipient of service located outside India"
      ],
      "consequence_if_failed": "If the supply is not an export of services, it will be subject to GST at the applicable rate. The supplier will need to pay the tax and any applicable interest under Section 50 of the CGST Act 2017. If there is a short payment or non-payment of tax, the supplier may also face penalties under Section 74A of the CGST Act 2017."
    }
  ],
  "limits": [
    "The specific valuation method for virtual digital assets is not explicitly provided in the rules, leading to reliance on the open market value method as a general fallback.",
    "The place of supply and the relationship between the supplier and recipient are unknown, which affects the determination of the export status."
  ],
  "_meta": {
    "llm": {
      "provider": "featherless",
      "models": {
        "small": "Qwen/Qwen2.5-7B-Instruct",
        "large": "Qwen/Qwen2.5-72B-Instruct",
        "adversarial": "mistralai/Mistral-Large-Instruct-2411"
      },
      "by_node": {
        "node1_extract": {
          "model": "Qwen/Qwen2.5-7B-Instruct",
          "calls": 1,
          "in_tokens": 1414,
          "out_tokens": 601,
          "retries": 0
        },
        "node2_gaps": {
          "model": "Qwen/Qwen2.5-7B-Instruct",
          "calls": 1,
          "in_tokens": 3023,
          "out_tokens": 80,
          "retries": 0
        },
        "node3_income_tax": {
          "model": "Qwen/Qwen2.5-72B-Instruct",
          "calls": 1,
          "in_tokens": 6624,
          "out_tokens": 475,
          "retries": 0
        },
        "node4_gst": {
          "model": "Qwen/Qwen2.5-72B-Instruct",
          "calls": 1,
          "in_tokens": 2341,
          "out_tokens": 525,
          "retries": 0
        }
      },
      "total_calls": 4,
      "total_in_tokens": 13402,
      "total_out_tokens": 1681,
      "temperature": "0 (dev default)",
      "note": "Figures above are the MEASURED run on this provider. Any Claude rupee-per-record figure quoted elsewhere is a metered deployment estimate, not this run."
    }
  }
}